9782894550723, , Au delà des mots, Au delà des mots, , 
9782894200846, , Damien mort ou vif, Damien mort ou vif, , 
9782923425863, , Escouade 06, Un escargot sur la main, , 
9782894302142, , Miss Septembre, Miss Septembre, , 
9782895373544, , Lune d entre elles, Lune d entre elles, , 
9782897141394, Roméo et Juliette, , Roméo et Juliette, , 
9782896510047, PAVEL T 01 PLUS VIVANT, , Pavel, , 
9782890519864, , Panique au Salon du livre, Panique au Salon du livre, , 
9782922944631, GERANIUM LE, , Le géranium, , 
9782890185982, , L étincelle suffit à la constellation, L étincelle suffit à la constellation, , 
9782890463230, , Hommes de profil, Hommes de profil, , 
9782896332243, , Le roi des vagabonds, Le roi des vagabonds, , 
9782896511822, UN PERROQUET DANS LE JARD, , Un perroquet dans le jardin, , 
9782922685268, , Cahier de roses de civilisation, Cahier de roses de civilisation, , 
9782762136845, , Le frère du trapéziste, Le frère du trapéziste, , 
9782894190395, , Le déchiffrement du monde, Le déchiffrement du monde, , 
9782895372349, , Ma soeur est une luciole, Ma soeur est une luciole, , 
9782896477135, , , Une affaire de conscience, Une affaire de conscience, 
9782764606674, , Pour de vrai pour de faux, Pour de vrai pour de faux, , 
9782923342320, Les entants de la table ronde, Les enfants de la table ronde, Les enfants de la table ronde, , 
9782921620235, , C est la nuit drôles de bruits, C est la nuit drôles de bruits, , 
9782922050905, , Les jumeaux Turmel, Les jumeaux Turmel, , 
9782890215342, , Le bon roi Adam, Le bon roi Adam, , 
9782921310333, , Les soifs multipliées, Les soifs multipliées, , 
9782896472420, , , Gnomes dépôt, Gnomes Dépôt Tome 1, 
9782890376397, , Beau soir pour mourir, Beau soir pour mourir, , 
9782924186084, , Celle d avant celle d après, Celle d avant celle d après, , 
9782922685314, , Mélanie Saint Laurent, Mélanie Saint Laurent, , 
9782922565262, , Angélica s est transportée, Angélica s est transportée, , 
9782896495597, Détours sur la route de Compostelle, , Détours sur la route de Compostelle, , 
9782892425123, , Le magicien d Oz, Le magicien d Oz, , 
9782894314692, Dans de beaux draps en Italie, , Dans de beaux draps en Italie, , 
978092183313X, , Birds of passage, Birds of passage, , 
9782897237509, , , L école du style volume 1, L École du style Tome 1, 
9782896951963, CHANTER DANS LE NOIR, , Chanter dans le noir, , 
9782890747034, , Et glissent les silences, Et glissent les silences, , 
9782894190441, , Papiers d épidémie, Papiers d épidémie, , 
9782895403821, , La nuit du tatou, La nuit du tatou, , 
9782894506547, , Caillou, Les grands parents, , 
9782896510344, DELIRONS AVEC LEON NO09, , Délirons avec Léon, , 
9782980401102, , Chant écho du coeur de Pablo, Chant écho du coeur de Pablo, , 
9782760411500, L Éphémère, , L Éphémère, , 
9782897232658, , , Des pêches pour monsieur le curé, Des pêches pour monsieur le curé, 
9782896475834, , , Frontenac, Frontenac Tome 2, 
9782890188020, , Un ami un nuage, Un ami un nuage, , 
9781550650394, , Mr Blue, Mr Blue, , 
9782897141516, Défense d entrer 4, , Défense d entrer 4 Opération Québec, , 
9782923574622, , Mon chef c est mon cœur, Mon chef c est mon coeur, , 
9782924561027, , Hunter Jones le trésor des seigneurs de Méliakin, Hunter Jones, , 
9782890376702, , Le glacier, Le glacier, , 
9782892611547, , Adèle intime, Adèle intime, , 
9782894552971, , Mary l Irlandaise, Mary l Irlandaise Maryse Rouy texte gros caractères, , 
9782890377245, , Pense à mon rendez vous, Pense à mon rendez vous, , 
9782895830835, , Open House, Open house, , 
9782897141332, La guerre des suces, , La guerre des suces, , 
9782894506899, , Caillou puts away his toys, Caillou puts away his toys, , 
9782894284101, , L oiseau d Eurémus, L oiseau d Eurémus et autres contes, , 
9782891116712, , L humoriste et l assassin, L humoriste et l assassin, , 
9782895029465, , , Contes à passer le temps version du 2017 12 06, , Contes à passer le temps
9782891117263, , La vengeance d un père, La vengeance d un père, , 
9782764812662, Outlander tome 3, , Le voyage, , 
9782896477609, , , La chèvre de bois, La Chèvre de bois, 
9782890378276, , Une terrifiante Halloween, Une terrifiante Halloween, , 
9782890186293, , Un ciel laiteux, Un ciel laiteux, , 
978276256753X, , Rendez vous porte 15, Rendez vous porte 15, , 
9782897237677, , , Zazie volume 2, Zazie Tome 2, 
9782760411470, Le Nain, Le Nain, Le Nain, , 
9782896472277, , Pas de mal à une mouche, Pas de mal à une mouche, Pas de mal à une mouche, 
9782890515737, , Le Violon, Le violon, , 
9782896606214, Au royaume des lasagnes NÂ 1, , Garfield, , 
9782890057100, , L enfant cigarier, L enfant cigarier, , 
9782894314630, Le Charme empoisonné, , Le charme empoisonné, , 
9782894507582, Caillou Quand je serai grand, , Quand je serai grand, , 
9782895791577, LUSTUCRU ET LE GD LOUP, , Lustucru et le grand loup bleu, , 
9782896474127, , , Chère Laurette tomes 1 à 4 versions du 2017 06 01, Chère Laurette Tome 4, 
9782981405791, , L affaire Delma, L affaire Delma, , 
9782893962025, , Guêpes, Guêpes, , 
9782980216374, , Le pacte avec les ours, Le pacte avec les ours, , 
9782921228084, , Temporel, Temporel, , 
9782892616996, , La parlante d outre mer, La parlante d outre mer, , 
9782896150885, Sous le ciel Nº 20, , Sous le ciel, , 
9782892614985, , La pivoine de jade, La pivoine de jade, , 
9782895683476, , Les pièces d or de Nicolas Flamel, Les pièces d or de Nicolas Flamel, , 
9782764022832, , Quand l amour efface le temps, Quand l amour efface le temps, , 
9782923150383, , Analphabête love, Débarc en ciel, , 
9782890214141, , La lune rouge, La lune rouge, , 
9782922265729, , Les mangues de Tara et autres nouvelles, Les mangues de Tara et autres nouvelles, , 
9782894856338, , Les sept larmes d Obéron, Les sept larmes d Obéron, , 
9782921197758, , L assassiné de l intérieur, L assassiné de l intérieur, , 
9782896959839, CHAMP MAUDIT LE, Le champ maudit, Le champ maudit, , 
9782921493292, , De lune à l autre, De lune à l autre, , 
9782890212459, , Le garçon qui rêvait d être un héros, Le garçon qui rêvait d être un héros, , 
9782897390952, , Le grand tour du Malmont, Malédictions au manoir, , 
9782894355039, Les diables de Tasmanie NÂ 39, Les diables de Tasmanie, , , 
9782895957041, , Les allergies de Gabriel, Les allergies de Gabriel, , 
9782890525678, , Le trésor de Luigi, Le trésor de Luigi, , 
9782894313800, Le Moulin du loup Tome 2, , Le chemin des falaises, , 
9782897394325, , Tristan au pays des géants, Tristan au pays des géants, , 
9782920887785, , Geste, Geste, , 
9782894288484, , Altitude zéro, Altitude zéro, , 
9782894356173, Les Messagers de Gaïa Tome 8, Le règne des Spiraliens, Les messagers de Gaïa, , 
9782921310554, , Le visage des cendres roman, Le visage des cendres, , 
9782890214850, , Sur les traces de Lou Adams, Sur les traces de Lou Adams, , 
9782897810429, , , Sam perd la carte, Sam perd la carte, 
9782762584426, , Toupie a peur, Toupie a peur, , 
9782923910789, Entre sœurs Tome 2, , Entre sœurs t 2 Dans le peau de Maïka, , 
9782892612330, , Un sourire blindé, Un sourire blindé, , 
9782897234324, , , Juliette à Barcelone, Juliette à Barcelone, 
9782894288603, , , Spécimens, Spécimens, 
9782896151233, La vieille fille et la mort Nº 36, , La vieille fille et la mort, , 
9782894314029, , Comme si de rien n était, Comme si de rien n était, , 
9782923153189, , Taximan, Taximan, , 
9782924563083, C est juste une joke, , C est juste une joke, , 
9782890182886, , L onde et la foudre, L onde et la foudre, , 
9782921255480, , Le bateau hanté, Le bateau hanté, , 
9782891116569, , Vie de Rosa, Vie de Rosa, , 
9782764407486, , Quand la mort s invite à la première, Quand la mort s invite à la première, , Quand la mort s invite à la première
9782895290296, , Louna et le dernier chevalier, Louna et le dernier chevalier, , 
9782894850344, , Tendres et emportés, Tendres et emportés, , 
9782891116674, , Les élus et les déçus, Les élus et les déçus, , 
9782922050844, , Vieilles nouvelles, Vieilles nouvelles, , 
9782894356739, L homme qui n avait pas de nombril, , L homme qui n avait pas de nombril, , 
9782923574752, La maison piège NÂ 9, , La maison piège, , 
9782895401799, , Console moi, Console moi, , 
9782764405956, , Vandal love ou Perdus en Amérique roman, Vandal love ou Perdus en Amérique, , 
9782923910222, Le monde de Khelia Tome 8 Ailleurs, , Le monde de Khelia, , 
9782895400784, , Le nuage de Nadine Souci, Le nuage de Nadine Souci, , 
9782892610753, , Vigie, Vigie, , 
9782897220037, Lit double tome 1, , Lit double, , 
9782896606061, Joies d hiver, , Cherche et trouve, , 
9782890313158, , Psyché au cinéma, Psyché au cinéma, , 
9782924025345, Lance et compte Tome 3, , Objectif 110, , 
9782921856393, , Sarah blues, Sarah blues, , 
9782764803677, , Fanette, Fanette, , 
9782895122229, , David et le précipice, David et le précipice, , 
9782890519562, , Quelle vie de chat, Quelle vie de chat, , 
9782897141721, Biscuit et Cassonade à New York, , Biscuit et Cassonade à New York, , 
9782897512095, Jake et les pirates du Pays Imaginaire Nº 2, , Jake et les pirates du pays imaginaire no 2, , 
9782897233372, , , Mon paradis perdu, Mon paradis perdu, 
9782896472208, , La force de vivre roman historique, La force de vivre, La Force de vivre Tome 1, 
9782922061413, , Le fil de Marie Anne entre deux eaux, Le fil de Marie Anne entre deux eaux, , 
9782895437574, Aventure de noel une, , Une aventure de Noël, , 
9782890313271, , Le rêveur roux, Le rêveur roux, , 
9782980215612, , Automne prélude rensaku, Automne prélude, , 
9782764604378, , Vacuum, Vacuum, , 
9782890216020, , Les veilleuses, Les veilleuses, , 
9782894191650, , Patrie intime et autres poèmes, Patrie intime et autres poèmes, , 
9782922884007, , Légendes de la rivière du Loup, Légendes de la rivière du Loup, , 
9782923520339, , Roxane chez les pirates, Roxane chez les pirates, , 
9782923844084, , La gare, La gare, , 
9782923813141, Le retrousse pet, , Le retrousse pet, , 
9782924563625, Saint Tite l objectif ultime Tome 1, , Rodéo, , 
9782890529177, , Côte des Nègres, Côte des Nègres, , 
9782893960987, , Les chairs tremblantes, Les chairs tremblantes, , 
9782896081004, , Maman solo, Maman solo, , 
9782890468356, , Silencieux lassos, Silencieux lassos, , 
9782890182959, , L oraison cassée, L oraison cassée, , 
9782921310236, , Cthulhu la joie, Cthulhu la joie, , 
9782922050661, , Le bonheur rend sourd, Le bonheur rend sourd, , 
9782896472222, , , Les enfants de Roches Noires, Les Enfants de Roches Noires Tome 1, 
9782764620847, , Paco, Paco, , 
978276480153X, , La femme de Berlin, La femme de Berlin, , 
9782897237936, , , Meurtre dans le ciel de Dorval, Meurtre dans le ciel de Dorval, 
9782896480913, Révélations, , Révélations, , 
9782760405117, , Petit homme tornade, Petit homme tornade, , 
9782896476121, , , À bord de l Ouragan, À bord de l Ouragan Tome 1, 
9782890212610, , Les deux Nazaire, Les deux Nazaire, , 
9782896452606, , Lettres à l assassin, Lettre à l assassin, , 
9782894507711, Caillou La magie du compost, , La magie du compost, , 
9782897232832, , , Mensonges sur le Plateau Mont Royal, Mensonges sur le Plateau Mont Royal Tome 1, 
9782895491828, , Pakkal À la recherche de l arbre cosmique, Pakkal, , 
9782896867608, , Je chante avec Galette, Je chante avec Galette, , 
9782764412886, , Samuel de la chasse galerie, Samuel de la chasse galerie, , 
9782897510893, Une partie de cache cache givrée, , Une partie de cache cache givrée, , 
978289512020X, , Célestine Motamo, Célestine Motamo, , 
9782764401787, , Sur la piste de l étoile, Sur la piste de l étoile, , 
9782760405567, , Presque tout Roch Carrier, Presque tout Roch Carrier, , 
9782894312865, L Amour écorché, , L amour écorché, , 
978289261192X, , Cet imperceptible mouvement, Cet imperceptible mouvement, , 
9782890055523, , Cette grenade dans la main du jeune Nègre est elle une arme ou un fruit, Cette grenade dans la main du jeune nègre est elle une arme ou un fruit, , 
9782897233396, , , Les Illustres Farceurs, Les Illustres farceurs, 
9782890053830, Cap à l amour, Cap à l amour, , , 
9782894190182, , Anna à la lettre c, Anna à la lettre c, , 
9782981492029, , Les trésors du pirate, Les contes fantastiques de Baba, , 
9782890214990, , Le grand roman d amour de Rosalie, Le grand roman d amour de Rosalie, , 
9782890068445, Le ciel n est qu un détour à brûler, Le ciel n est qu un détour à brûler, Les grands cimetières, , 
9782897237080, , , C est la faute à, C est la faute à coffret, 
9782896510245, ALLERGIKS EPISODE 08 FOUI, , Les Allergiks, , 
9782897233365, , , Mon paradis perdu, Mon paradis perdu, 
9782894285922, , L écrit qui tue, L écrit qui tue, , 
9782896072774, Pépé Camisole un hiver pas comme les autres, , Pépé Camisole un hiver pas comme les autres, , 
9782895290571, , Le cri du guerrier harougagawak roman, Le cri du guerrier, , 
9782924563120, Première escale, , Première escale, , 
9782894353006, , Will Ghündee Le monde parallèle, Will Ghündee, , 
9782897142056, Objectif l Impact Plan de match, , Plan de match, , 
9781926723303, , , Le mal dans sa divinité, , Le mal dans sa Divinité
9782890376567, , Klonk, Klonk ou comment se débar r asser des adolescents, , 
9782923574202, Épitaphes, Épitaphes la fin d Innstown et de Silent Valley, Épitaphes, , 
9782895431787, Culotte a air 6 r, , Culotte à air, , 
9782896477012, , , Mon frère est plus fort que Louis Cyr, Mon frère est plus fort que Louis Cyr, 
9782894061056, , Le coeur de la baleine bleue, Le coeur de la baleine bleue, , 
9782895291510, , Itinérances, Itinérances, , 
978289021673X, , La marathonienne, La marathonienne, , 
9782890315371, , Maman goélande fable de rue, Maman goélande, , 
9782924328095, , Croque Tout, Croque Tout, , 
9782890244597, , Le Hasard des rencontres, Le hasard des rencontres, , 
978276460193X, , La brèche, La brèche, , 
9782923662329, Katana, , Katana, , 
9782890213196, , La musique des choses, La musique des choses, , 
9782894507216, Caillou Mon premier spectacle, , Caillou, , 
9782894312938, , La main étrangère, La main étrangère, , 
9782760617270, , Poèmes en prose, Poèmes en prose, , 
9782897720360, , Zones de proximité, Zones de proximité, , 
9782764811986, Feu tome 5, , Feu tome 5 Le Patriote errant, , 
9782896904051, , Les soeurs Beaudry, Les soeurs Beaudry, , Les Soeurs Beaudry tome 1
978276440221X, , Le vendeur et le millionnaire, Le vendeur et le millionnaire, , 
9782895792420, SUPER TOUTOU NO01 CONTRE, Super Toutou contre les voleurs de fourrures, Super Toutou contre les voleurs de fourrures, , 
9782896512652, FELICIEN ET LA GROSSE POM, , Félicien et la grosse pomme, , 
9782897812478, , , , Pic de température, Pic de température
9782896606047, Coffret Princesses, , Princesse, , 
9782923396088, , Super Princesse, Super Princesse, , 
9782896513277, ROCK ROSE COFFRET 1, , Rock Rose, , 
9782891119096, , Des ailes au coeur, Des ailes au coeur, , 
9782890464636, , Entre deux gorgées de mer, Entre deux gorgées de mer, , 
9782895400466, , Max et Maurice en sept mauvais coups, Max et Maurice en sept mauvais coups, , 
9782890215636, , Marilou Polaire et la magie des étoiles, Marilou Polaire et la magie des étoiles, , 
9782895021147, , Les cinq saisons du moine, Les cinq saisons du moine, , 
9782924355022, , Rosabelle, Rosabelle, , 
9782924430095, , Les coucous de Marilou, Les coucous de Marilou, , 
9782896607914, Jamais sans Odie Nº 4, , Garfield BD thématique, , 
9782890184943, , Le cycle des migrations, Le cycle des migrations, , 
9782764620489, , Les vrais cochons, Les vrais cochons, , 
9782897237073, , , C est la faute à, C est la faute à coffret, 
9782892612136, , Tombeau, Tombeau, , 
9782894300573, , Douze coups de théâtre, Douze coups de théâtre, , 
9782896604074, La fête surprise de Mater, , La fête surprise de Mater, , 
9782895684596, , Eliza et le petit duc, Eliza et le petit duc, , 
9782895435075, Voeux d hiver, , Voeux d hiver, , 
9782890528065, , Une mission difficile, Une mission difficile, , 
9782764018705, Sexplicites, , Sexplicites, , 
9782924430118, , Les vroumvroums de Patapoum, Les vroumvroums de Patapoum, , 
9782897032098, Laissée pour morte, , Laissée pour morte, , 
9782896477395, , , La porte les mouches, La porte les mouches, 
9782897512163, Fraisy fait du cinéma, , Fraisy fait du cinéma, , 
9782764010952, Grande aventure et petites histoires libertines, , Grande aventure et petites histoires libertines, , 
9782894190670, , Les quatre morts de Marie, Les quatre morts de Marie, , 
9782894314746, Les enquêtes de Maud Delage 4, , Les enquêtes de Maud Delage, , 
9782892611822, , Les épervières, Les épervières, , 
9782895684077, , Blanche Nouille et les militants d Onaria, Blanche Nouille et les militants d Onaria, , 
9782890517489, , La Gaillarde, La Gaillarde, , 
9782980564893, , Les anges d Angélica autour de mon pays, Les anges d Angélica autour de mon pays, , 
9782890515958, , Mortellement vôtre, Mortellement vôtre, , 
9782760411999, Ça sent la coupe, , Ça sent la coupe, , 
9782897234607, , , Meurtre à Westmount, Meurtre à Westmount, Meurtre à Westmount
9782895021724, , L ange au berceau, L ange au berceau, , 
9782896512607, PTE SOEUR LA 9, , La petite soeur, , 
9782895370338, , Identité provisoire, Identité provisoire, , 
9782897235338, , , Frankenstein, Frankenstein, 
9782896955596, ROUGE BABINE AU VAMPIRATU, , Rouge Babine au Vampiratum, , 
9782897220310, La Saline tome 2, , La Saline v 2 Impasse, , 
9782890376451, , Sans coeur et sans reproche, Sans coeur et sans reproche, , 
9782896480784, Le regard est une longue montée, , Le regard est une longue montée, , 
978289431194X, , Maria, Maria, , 
9782896517343, MIKAZUKI T01 NUIT DES DE, , Mikazuki, , 
9782897233860, , , Les portes de Québec, Les Portes de Québec coffret, 
9782764621677, , L héritage, L héritage, , 
978289052762X, , L ombre et le double, L ombre et le double, , 
9782897233402, , , Les illustres farceurs, Les Illustres farceurs, 
9782896476275, , , Tableau meurtrier, Tableau meurtrier, 
9782890773516, , Dans le secret des dieux, Dans le secret des dieux, , 
9782897231842, , , Mon royaume pour un biscuit, Mon royaume pour un biscuit, 
9782923898285, , Les couloirs de l éternité, Les couloirs de l éternité, , 
9782890186804, , Un juste ennui, Un juste ennui, , 
9782921956381, , Carnets secrets d Agathe Brisebois, Carnets secrets d Agathe Brisebois, , 
9782896450466, , Poèmes du lendemain 16, Poèmes du lendemain 16, , 
9782897511159, Le combat des chefs, , Le combat des chefs, , 
9782924430163, , Le petit renne au nez blanc, Le petit renne au nez blanc, , 
9782895129974, , Le Noël du petit gnouf, Le Noël du petit Gnouf, , 
9782896474356, , , Dans l ombre de Lady Jane, Dans l ombre de Lady Jane, 
9782895129165, , Le rôdeur du lac, Le rôdeur du lac, , 
9782896073474, Les trois moustiques verts Nº 55, , Les trois moustiques verts, , 
9782896072569, La bande des Z Nº 123, , La bande des Z, , 
9782896600274, Garfield NÂ 46, , Garfield, , 
978276211683X, , Une saison dans la vie d Emmanuel, Une saison dans la vie d Emmanuel, , 
9782890211851, , L étrange amour d Edgar, L étrange amour d Edgar, , 
9782890184064, , De quelle bouche sommes nous, De quelle bouche sommes nous, , 
9782896476725, , , Le Sentier des Roquemont tome 1, Le Sentier des Roquemont Tome 1, 
9782897261580, Le bonheur d être soi selon Sœur Angèle, Le bonheur d être soi selon sœur Angèle 100 questions sur la vie, , , 
9782764600925, , L abominable homme des sables, L abominable homme des sables, , 
9782762584221, , Les démons de Babylone, Les démons de Babylone, , 
9782891118421, , L homme qui ne pouvait vivre sans sa fille, L homme qui ne pouvait vivre sans sa fille, , 
9782895123675, , Les perdus magnifiques, Les perdus magnifiques, , 
9782897231293, , , Le comte de Saint Germain volume 2, Le Comte de Saint Germain Tome 2, 
9782896151639, Il y aura des morts Nº 60, , Il y aura des morts, , 
9782896073658, Le mur de feu Nº 59, , Le mur de feu, , 
9782924563090, Les débuts de Tristan Nº 1, , L étonnante saison des pumas Tome 1, , 
9782923662381, La Suppléante, , La suppléante, , 
9782762584434, , Toupie se fâche, Toupie se fâche, , 
9782922528308, , Terre des pigeons, Terre des pigeons contes, , 
9782893961762, , Le chaud lapin, Le chaud lapin, , 
9782923813202, Les règles de Simon Nº 2, , Les règles de Simon, , 
9782890313255, , Pas si bête ma vie de chien, Pas si bête ma vie de chien, , 
978289261094X, , Le grand départ, Le grand départ, , 
9782764812006, Tsunamis, , Tsunamis, , 
9782890067776, Les dés de chagrin, , Les dés de chagrin, , 
9782923698144, , An Cham, An Cham, , 
9782924020111, , Poèmes Esprit, Poèmes esprit, , 
9782897220334, Elle et nous, , Elle et nous, , 
9782895980047, , Portraits d Elsa et autres histoires, Portraits d Elsa et autres histoires, , 
9782895124175, , Le dodo des animaux, Le dodo des animaux, , 
9782890378160, , Le cauchemar de Klonk, Le cauchemar de Klonk, , 
9782897260415, Dieulefit, , Dieulefit, , 
9782896514212, ROCK ROSE COFFRET 2, , Rock Rose, , 
9782895492771, , Arielle Queen Premier voyage vers l Helheim, Arielle Queen, , 
9782896601660, Garfield NÂ 52, , Garfield, , 
9782894288849, , , À l ombre du clocher, À l ombre du clocher Tome 1, A l ombre du clocher tome 1
9782897740535, VIEUX LIVRES SONT DANGERE, Les vieux livres sont dangereux, Les vieux livres sont dangereux, , 
9782896606269, Bienvenue à l Académie royale, , Bienvenue à l Académie royale, , 
9782923342070, , Miro et les canetons du lac Vert, Miro et les canetons du lac Vert, , 
9782923342764, Mingan mon village, , Mingan mon village, , 
9782895439332, Bone Tome 8, , Bone, , 
9782896512430, QUELLE PAGAILLE, Quelle pagaille, Quelle pagaille, , 
9782894351062, Le loup, , Le loup, , 
9782894355152, Gaïg Tome 10, , Gaïg, , 
9782895404019, , Parle Petit Loup, Parle Petit Loup, , 
9782895126782, , Ritou le raton qui n aimait pas la pluie, Ritou le raton qui n aimait pas la pluie, , 
9782894852460, , Pension vaudou, Pension vaudou, , 
9782764600917, , L inconnu du placard, L inconnu du placard, , 
9782895125532, , Bébé vampire, Bébé vampire, , 
9782922572781, , Pure libertine, Pure libertine, , 
9782923603797, , , Comment appeler et chasser l orignal, , Comment appeler et chasser l orignal
9782890215075, , La patte dans le sac, La patte dans le sac, , 
9782764805787, Mission sacrée 1, , Mission sacrée, , 
9782896490295, Deux cercles, , Deux cercles, , 
9782890313956, , Métropolis opéra, Métropolis Opéra suivi de Tribu, , 
9782764620120, , Onze petites trahisons, Onze petites trahisons, , 
9782896864195, , Galette prend son bain, Plouf À l eau avec Galette, , 
9782895794448, LUMIERE DE NEW YORK, La lumière de New York, La lumière de New York, , 
9782981291219, , Petit pot de biscuits 2 devient rapidement vide s il donne sans jamais recevoir, Petit pot de biscuits, , 
9782894286007, , Opération Juliette, Opération Juliette, , 
9782890217191, , Vol à l étalage, Vol à l étalage, , 
9782894351844, , Le rêve de Tamaïna, Le rêve de Tamaïna, , 
9782922944532, RHADAMANTHE, Rhadamanthe, Rhadamanthe, , 
9782923342535, C est à moi, , C est à moi, , 
978289005912X, , Migrances, Migrances suivi de Una donna, , 
9782923662398, Un purgatoire, , Un purgatoire, , 
9782896604838, La chasse à la citrouille, , Chasse à la citrouille, , 
9782896513826, KABOUM T32 YEUX D UHURU, , Kaboum, , 
9782980985928, , Réverbère, Réverbère, , 
9782897234713, , , Les années de plomb, Les Années de plomb Tome 4, 
978289005814X, , Cette grenade dans la main du jeune nègre est elle une arme ou un fruit, Cette grenade dans la main du jeune nègre est elle une arme ou un fruit, , 
9782894502966, , Caillou, Caillou, , 
9782890519201, , Quel cirque mon Coco, Quel cirque mon Coco, , 
978276460338X, , Les dimanches sont mortels, Les dimanches sont mortels, , 
9782895021279, , Espaces à occuper, Espaces à occuper, , 
9782890186019, , L oeil au ralenti, L oeil au ralenti, , 
9782897621063, Epsilon Tome 1, , Epsilon Volume 1, , 
9782894508367, Caillou Le défilé des couleurs, , Le défilé des couleurs, , 
9782890311864, , Chansons et chroniques de la baleine, Chansons et chroniques de la baleine, , 
9782923425665, , Les fiancés de Gdansk, Les fiancés de Gdansk, , 
9782921561476, , Antipodes, Antipodes, , 
9782894307462, , Et si c était ça le bonheur, Et si c était ça le bonheur, , 
9782890059634, Ma vie en rouge, Ma vie en rouge, , , 
9782890241300, , Les sept nuits de Laura, Les sept nuits de Laura, , 
9782896475018, , , La mère Noëlle, Les JJ s Tome 6, 
9782897523473, , D art et de sang tome 2, D art et de sang, , 
9782923708256, AQUA LA MECHANTE SIRENE, , Aqua la méchante sirène, , 
9782896476930, , , Le journal de Justine et Juliette, Les JJ s Tome 1, 
9782894191855, , Histoires saintes, Histoires saintes, , 
9782890065723, , Illuminures, Illuminures, , 
978292181840X, , Les habituées du hasard, Les habituées du hasard, , 
9782896510436, KABOUM T03 LE SOUFFLE, , Kaboum, , 
9782895170754, , Bécassine l oiseau invisible, Bécassine l oiseau invisible, , 
9782760903486, , Je vous écris du Caire, Je vous écris du Caire, , 
9782890212424, , Comme une peau de chagrin, Comme une peau de chagrin, , 
9782761331272, , Un papa en retard, Un papa en retard, , 
9782895401217, , Voyage en Amnésie et autres poèmes débiles, Voyage en Amnésie et autres poèmes débiles, , 
9782894356203, Le voleur de voix Tome 3, , Le voleur de voix, , 
9782890241262, , La ligne de feu, La ligne de feu, , 
9782895350361, Puss in boots, , Puss in boots, , 
9782897700850, REP JOHN LENNON, , R E P John Lennon, , 
