9782760931862, , L été des eiders, L été des eiders, , 
9782921197367, , Silences, Silences, , 
9782895406686, , La peine de Sophie Fourire, La peine de Sophie Fourire, , 
9782894190808, , Un homme défait, Un homme défait, , 
9782890185273, , Une écharde sous ton ongle, Une écharde sous ton ongle, , 
9782896332946, , , Agrippine la pas fine, , Le Puits
9782890214753, , Un monstre dans les céréales, Un monstre dans les céréales, , 
9782896869985, , Papillons de l ombre, Papillons de l ombre, , 
9782764601166, , Catoblépas, À l ombre du bûcher, , 
9782895021325, , Le cri des coquillages, Le cri des coquillages, , 
9782764805329, Journal d un disparu, , Journal d un disparu, , 
978289051918X, , Le séducteur, Le séducteur, , 
9782896472819, , , À l ombre du clocher, À l ombre du clocher Tome 2 compact, 
9782890066738, , Souvent la nuit tu te réveilles, Souvent la nuit tu te réveilles, , 
9782923708461, HIS ET LEGENDES QC, , Histoires et légendes du Québec, , 
9782895121206, , Christophe au grand coeur, Christophe au grand coeur, , 
9782896512119, DELIRONS AVEC LEON NO26, , Délirons avec Léon, , 
9782921425718, , Poupées gigognes, Poupées gigognes, , 
9782760405192, , Retour sur les années d éclipse, Retour sur les années d éclipse, , 
9782894354780, will GhÃ¼ndee L éveil du guerrier, Will Ghündee L éveil du guerrier, Will Ghündee, , 
9782896331987, , Meurtre à distance, Meurtre à distance, , 
9782895493570, , Revenir à toi, Revenir à toi, , 
9782897237301, , , Père et mère tu honoreras, Père et mère tu honoreras, 
9782890183211, , Oasis, Oasis, , 
9782895120447, , Alex le petit joueur de hokey, Alex le petit joueur de hockey, , 
9782890241602, , Je t aime cowboy, Je t aime cow boy, , 
9782764810682, Outlander tome 8 partie 1, , Outlander v 8 1 Écrit avec la sang de mon coeur, , 
978189436340X, , A kiss for Peter, A kiss for Peter, , 
9782894304137, , Fidèles trahisons, Fidèles trahisons, , 
9782890186095, , Quelques éclats, Quelques éclats, , 
9782890213595, , Des citrouilles pour Cendrillon, Des citrouilles pour Cendrillon, , 
9782923896052, GD REMOUS, , Grand Remous, , 
9782896475049, , , Damné tome 2, Damné Tome 2, 
9782896470150, , M comme momie, La bande de la 7e, La Bande de la 7e Tome 2, 
9782890319738, , Debout sur le côté des choses, Debout sur le côté des choses, , 
9782923910253, La nuit du tueur, La nuit du tueur, La nuit du tueur, , 
9782890183513, , Affûts, Affûts, , 
9782890184153, , Brisants, Brisants, , 
9782922762297, , Gaëlle le jumeau Gilles et la jugeote, Gaëlle le jumeau Gilles et la jugeote, , 
9782897232696, , , Madame Tout le Monde, Madame Tout le monde Tome 3, 
9782897237882, , , Les années de plomb, Les Années de plomb coffret, 
9782764620205, , Max au Centre Bell, Max au Centre Bell, , 
9782890185001, , Lignes aériennes, Lignes aériennes, , 
9782896151448, Malphas 1 Le cas des casiers carnassiers Nº 174, , Malphas t 1 Le cas des casiers carnassiers, , 
9782895911104, , OK pour le hockey, OK pour le hockey, , 
9782895022038, , L inconnu dans la voiture rouge, L inconnu dans la voiture rouge, , 
978289431289X, , Parfum d anges, Parfum d anges, , 
9782896474257, , , Le violoncelliste sourd, Le Violoncelliste sourd, 
9782896493746, Le réveil de la bête, , Le réveil de la bête, , 
9782890241130, , Onyx John, Onyx John, , 
9782896474325, , , Un bonheur si fragile tome 3, Un bonheur si fragile Tome 3 compact, 
9782895797500, ENIGME D EMILE L, , L énigme d Émile, , 
9782890216934, , Les bisous tout doux, Les bisous tout doux, , 
9782895492375, , Le journal d Aurélie Laflamme, Le journal d Aurélie Laflamme, , 
9782890214060, , Panthère civière et vive colère, Panthère civière et vive colère, , 
9782890376362, , Les Botero, Les Botero, , 
9782896478354, , , Le talisman de Nergal volume 5, Le Talisman de Nergal Tome 5, 
9782894850395, , Haine moi, Haine moi, , 
9782764400438, , Premier trophée pour Momo de Sinro, Premier trophée pour Momo de Sinro, , 
9782895403524, , Petits fantômes mélancoliques, Petits fantômes mélancoliques, , 
9782890219458, DELIRONS AVEC LEON NO06, , Délirons avec Léon, , 
9782895832157, , Cochonner le plancher quand la terre est rouge, Cochonner le plancher quand la terre est rouge, , 
9782896605231, Garfield, , Garfield poids lourd, , 
9782896510610, KABOUM T10 LE MEDAILLON, , Kaboum, , 
9782897220129, Volte face et malaises, , Volte face et malaises, , 
9782896472048, , Le veilleur, Le veilleur, Le Veilleur, 
9782896605637, Spider Man NÂ 3, , Spider Man, , 
9782923574882, La planète des Mignons, , La planète des mignons, , 
9782896071494, Prisonniers du frigo Nº 42, , Prisonniers du frigo, , 
9782981439260, , Marques déposées, Marques déposées poèmes, , 
9782922528219, , Contes coquins pour oreilles folichonnes, Contes coquins pour oreilles folichonnes, , 
9782896474578, , , Chère Laurette, Chère Laurette Tome 3 compact, 
9782896331253, , Trois séjours en sombres territoires, Trois séjours en sombres territoires, , 
9782923910765, Au secours, , Au secours Je suis un éléphant, , 
9782764427170, , Coup d envoi, Coup sur coup, , 
9782896494194, Corax, , Corax, , 
9781550651056, , Keep it all, Keep it all, , 
9782890216748, , Averses et réglisses noires, Averses et réglisses noires, , 
9782924304006, , Mystère autour de ma naissance, Mystère autour de ma naissance, , 
9782921403412, , La dent au bout du fil, La dent au bout du fil, , 
9782896453160, , Avant de renoncer, Avant de renoncer, , 
9782895490953, , Aurélie, Aurélie, , 
9782895404378, , Cruelle Cruellina, Cruelle Cruellina, , 
9782894314142, La boiteuse, La boiteuse, La boiteuse, , 
9782896070480, Am Stram Gram et calligrammes Nº 70, , Am stram gram et calligrammes, , 
978289021737X, , Les enfants de Doodletown, Les enfants de Doodletown, , 
9782764400691, , La beauté du monde, La beauté du monde, , 
978289031393X, , Le repos piégé, Le repos piégé, , 
978292222502X, , Octave et la dent qui fausse, Octave et la dent qui fausse, , 
9782892952988, 1704, 1704 captive des Indiens, 1704 captive des Indiens, , 
9782897239268, , , 1967, 1967 coffret, 
9782890317017, , L évadé, L évadé, , 
978289512373X, , Les orages d Amélie tout court, Les orages d Amélie tout court, , 
9782897142537, Midget, , Midget, , 
9782895127970, , Jomusch et les mains de papier, Jomusch et les mains de papier, , 
9782760933637, , Les sangs, Les sangs, , 
9782894190751, , Le coeur est un objet noir caché en nous, Le coeur est un objet noir caché en nous, , 
9782896510634, UNE PLAGE TROP CHAUDE, Une plage trop chaude, Une plage trop chaude, , 
9782895953227, , Zazou, Zazou, , 
9782897141714, Biscuit et Cassonade au Mexique, , Biscuit et Cassonade au Mexique, , 
9782764000979, , ITI, ITI, , 
9782923713489, , Au pied de mon orgueil, Au pied de mon orgueil, , 
9782896626458, , À la dérive, À la dérive, , 
9782924563137, Crocoman Nº 34, Crocoman, Crocoman, , 
9782922572471, , Le cerf volant, Le cerf volant, , 
9782890211878, , Les voix truquées, Les voix truquées, , 
9782896677467, , Le tombeau de Tzardès, Les 7 cristaux de Shamballa, , 
9782890214079, , La fièvre du Mékong, La fièvre du Mékong, , 
9782895980136, , Ashini, Ashini, , 
9782764812259, Chemin de croix, , Chemin de croix, , 
9782923372402, , Le mystère du t shirt, Le blogue de Namasté, , 
9782896943418, , , Ici ailleurs, , Ici ailleurs
9782895953128, , Le sceptre magique, Le sceptre magique, , 
9782890067875, Les abattoirs de la grâce, Les abattoirs de la grâce, Les abattoirs de la grâce, , 
9782764400454, , Prisonniers dans l espace, Prisonniers dans l espace, , 
9782896955978, FANFAN ET LE MONSTRE NOEL, , Fanfan et le monstre de Noël, , 
9782895127673, , Trop copieuse, Trop copieuse, , 
9782897238322, , , La maison du silence, La maison du silence, 
9782896480364, Portrait de dos, , Portrait de dos, , 
9782890771938, , Le jardin de Rousseau, Le jardin de Rousseau, , 
9782895127550, , Trafic au Burkina Faso, Trafic au Burkina Faso, , 
9782892614457, , La rivière du loup, La rivière du loup, , 
9782895795926, CHEZ LES SIRENES, , Chez les sirènes, , 
9782896513734, PACIFIC EXPRESS T01 TERRE, Terreur sur la ligne d acier, Pacific Express, , 
9782897391478, , Mission pas possible No 1, Mission pas possible, , 
9782922883124, , Quatre petits contes de Noël, Quatre petits contes de Noël, , 
9782890184781, , Un visage appuyé contre le monde, Un visage appuyé contre le monde, , 
9782896150243, Le vide NÂ 110, , Le vide, , 
9782922976380, , Les petites misères de Meghan Barrière, Les petites misères de Meghan Barrière, , 
9782895901228, , La Tunisie de Ben Ali, Si Dieu le veut, , 
9782890376583, , La grotte de Toubouctom, La grotte de Toubouctom, , 
9782893816517, Marie Mousseau 1937 1957, , Marie Mousseau 1937 1957, , 
978292323412X, , La tisserande du ciel, La tisserande du ciel, , 
9782924860007, , La kermesse, La kermesse, , 
9782897233334, , , Oliver et les îles vagabondes, Oliver et les îles vagabondes, 
9782892615456, , Mon frère Ésaü, Mon frère Ésaü, , 
9782895831033, , La baleine d Aubert, La baleine d Aubert, , 
9782920887750, , Profession Indien, Profession, , 
9782896491322, Où suis je, Où suis je, , , 
9782890519163, , Les naufragés d Illophène, Storine l orpheline des étoiles, , 
9782897232825, , , Mensonges sur le Plateau Mont Royal, Mensonges sur le Plateau Mont Royal Tome 1, 
9782897230760, , , Bébé boum, Bébé boum Tome 1, 
9782896867998, , Mon premier dico des noms avec Galette et ses amis, Mon premier dico avec Galette, , 
9782896605002, Bijoux de princesses, , Bijoux de princesses, , 
9782761330930, , La guerre aux peluches, La guerre aux peluches, , 
9782895290210, , Des mondes nous échappent, Des mondes nous échappent, , 
9782764425725, , Coup de foudre, Coup sur coup, , 
9782894190549, , De la nature des mondes animés et de ceux qui y habitent, De la nature des mondes animés et de ceux qui y habitent, , 
9782980401706, , Évanescence, Évanescence, , 
9782762540437, , Les sandales d Ali Boulouf, Les sandales d Ali Boulouf, , 
9782890379477, , Vingt et un tableaux et quelques craies, Vingt et un tableaux et quelques craies, , 
9782895125341, , Destructotor, Destructotor, , 
9782760931676, , La pêche blanche, La pêche blanche, , 
9782896453382, , Bruits suivi de Coma symphonique, Bruits suivi de Coma symphonique, , 
9782764406120, , La machine à orgueil, La machine à orgueil, , 
9782895371762, , La plus belle de l école, La plus belle de l école, , 
9782897140519, L incroyable aventure de Matisse et des vaches lunaires, L incroyable aventure de Matisse et des vaches lunaires, L incroyable aventure de Matisse et des vaches lunaires, , 
9782761330565, , Coassons avec Ouaouaron, Coassons avec Ouaouaron, , 
9782896478163, , , Marika et ses amis tome 2, Marika et ses amis Tome 2, 
978292131083X, , Le chant des retrouvailles, Le chant des retrouvailles, , 
9782764603053, , Visions volées, Visions volées, , 
9782890314502, , Les petits soldats, Les petits soldats, , 
9782895510105, , Rapt, Rapt, , 
9782923338576, , Odes radiophoniques, Odes radiophoniques, , 
9782764401604, , Tohu Bohu le génie disparu, Tohu Bohu, , 
9782764400055, , La nuit des horreurs, Noémie, , 
9782923530338, , Wigrum, Wigrum, , 
9782921818513, , Sous le masque des heures, Sous le masque des heures, , 
9782922585865, , , 184 rue Beaubien, , 184 rue Beaubien
9782895854289, , Sortie de filles L enterrement de vie de jeune fille, Sortie de filles L enterrement de vie de jeune fille, , 
9782895791515, OU EST TAT TSANG, , Où est Tat Tsang, , 
9780921833377, , The tragedy queen, The tragedy queen, , 
9782895124329, , Turlu Tutu et Fanfan l éléphant, Turlu Tutu et Fanfan l éléphant, , 
9782897239091, , , Tel était leur destin volume 2, Tel était leur destin Tome 2, 
978292125302X, , L homme du silence, L homme du silence, , 
9782896494736, Des histoires d hiver avec encore plus de rues d écoles et de hockey, , Des histoires d hiver avec encore plus de rues d écoles et de hockey, , 
9782894282834, , L araignée souriante, L araignée souriante, , 
9782896479849, , , Félicité, Félicité Tome 3, 
9782764407684, , Je suis Louna et je pars à l aventure, Je suis Louna et je pars à l aventure, , 
9782890911861, , Le livre d Emma, Le livre d Emma, , 
9782897510039, Superhéros Nº 6, , Superhéros, , 
9782896150816, Malphas 2 Torture luxure et lecture Nº 18, , Malphas, , 
9782897183820, Caillou se brosse les dents, , Caillou se brosse les dents, , 
9781553890454, , Baby Toopy, Baby Toopy, , 
9782921197340, , La complainte d Alexis le trotteur, La complainte d Alexis le trotteur, , 
9782897238292, , , L école du style v 2 Instagram talons plats et autres tracas, L École du style Tome 2, 
9782892951607, , Hier les enfants dansaient, Hier les enfants dansaient, , 
9782896080670, , Sur le bout de la langue, Sur le bout de la langue, , 
9782896330386, , Double foyer, Double foyer, , 
9782921898640, , Steven le hérault, Steven le hérault, , 
9782894489192, , Grosse, , , Grosse
9782895437253, Diego a la rescousse du papillon bleu, , Diego à la rescousse du papillon bleu, , 
9782897236601, , , Jours parfaits, Jours parfaits, 
9782890214915, , Un rendez vous troublant, Un rendez vous troublant, , 
9782894192592, , L absolu est un dé rond, L absolu est un dé rond, , 
9782895120625, , Un ami pour Toupie, Un ami pour Toupie, , 
9782895439103, Sommes nous arrives, , Sommes nous arrivés, , 
9782896331390, , Zack et ses électrons, Zack et ses électrons, , 
9782923662220, Llouis qui tombe tout seul, , Llouis qui tombe tout seul, , 
9782760402126, Pays voilés, Pays voilés Existences, , , 
9782896602469, Garfield NÂ 55, , Garfield, , 
9782922225119, , Le champion du lundi, Le champion du lundi, , 
9782891115848, , Bonjour Charles, Bonjour Charles, , 
9782894300999, , L été de l île de Grâce, L été de l île de Grâce, , 
9782894505861, Caillou Bonne nuit, , Caillou, , 
9782896471782, , , Le talisman de Nergal, Le Talisman de Nergal Tome 5, 
9782896471614, , , Pirates, Pirates Tome 3, 
9782924259313, Sept Tome 4, , Enkre moi, , 
9782894285647, , Une course folle, Une course folle, , 
9782897512538, Les expériences de Mini Jean Tome 1, , Les expériences de Mini Jean t 1, , 
9782923234073, , Ouille mes oreilles, Ouille mes oreilles, , 
9782923662404, Le Cirque bleu, , Le cirque bleu, , 
9782894283032, , Auberge du fantôme bavard, L auberge du fantôme bavard, , 
9782894507858, Caillou Ma boîte à histoires, , Caillou ma boîte à histoires, , 
9782895437239, Princesse ballerine, , Princesse ballerine, , 
9782895439301, Volt mon hero, , Mon héros, , 
9782980963216, , Résonances, Résonances, , 
9782923715544, Flavie grain de sable, , Flavie grain de sable, , 
9782897235789, , , Juliette à La Havane, Juliette à La Havane, 
9782924380000, , Ali Baba et les quarante voleurs intergalactiques, Ali Baba et les Quarante Voleurs intergalactiques, , 
9782890518205, , Maïa et l oiseau, Maïa et l oiseau, , 
9782897239336, , , Une vie à quatre vitesses, Une vie à quatre vitesses, 
9782890316898, , Le cri des glaciers, Le cri des glaciers, , 
978276440140X, , Pendant la mort, Pendant la mort, , 
9782896866724, , Les formes, Les formes, , 
9782924438077, , Perfecto Tome 7, Perfecto, , 
9782897237851, , , Le tout pour le tout, Passion Hockey Tome 5, 
9782897236564, , , Les chroniques de Chambly tome 3, Les Chroniques de Chambly Tome 3, 
9782924206010, , Adel le Sémite ou L éclipse du printemps, Adel le Sémite ou l éclipse du printemps, , 
9782897181130, Caillou est amoureux, , Caillou est amoureux, , 
9782897237608, , , La théorie du drap contour, La théorie du drap contour, 
9782980257214, , Le coeur a toujours besoin d un visage dans sa tête 1991 1994, Le coeur a toujours besoin d un visage dans sa tête, , 
9782896510122, PAVEL T 09 SANS LES FIL, , Pavel, , 
9782896476350, , , J ai eu peur d un quartier autrefois, J ai eu peur d un quartier autrefois, 
9782895129943, , Les petits jardiniers, Les petits jardiniers, , 
9782764406854, , La tendresse du serpent, La tendresse du serpent, , 
9782897123994, , Surqualifié, Surqualifié, , 
9782896860050, , Bouge avec Galette, Bouge avec Galette, , 
9782892616040, , Il pleuvait des oiseaux, Il pleuvait des oiseaux, , 
9782760932036, , Darling, Darling, , 
9782896670727, , Le mystère Boojerooma, Le mystère Boojerooma, , 
9782896330928, , Les îles mystérieuses, Les îles mystérieuses, , 
9782895404026, , La poupée cassée, La poupée cassée, , 
9782890066843, , Jardin des vertiges, Jardin des vertiges, , 
9782764605486, , Les coureurs de l arc en ciel, Les coureurs de l arc en ciel, , 
978276440087X, , Les choses terrestres, Les choses terrestres, , 
9782895403234, , Papy où t as mis tes dents, Papy où t as mis tes dents, , 
9782896480968, Cette personne très laide qui s endort dans mes bras, , Cette personne très laide qui s endort dans mes bras, , 
9782896601752, Les bagnoles, , Les bagnoles, , 
9782896470754, , , La louve de mer, La Louve de mer Tome 1, 
9782894312326, , Circée l enchanteresse, Circée l enchanteresse, , 
9782922145069, Ouverture Nº 7, Ouverture, Ouverture, , 
9782897230913, , , Le sentier des Roquemont, Le Sentier des Roquemont Tome 2 compact, 
9782897141776, La belle histoire d une vieille chose, , La belle histoire d une vieille chose, , 
9782923574820, Le royaume des Ã menivores NÂ 11, , Le royaume des Âmenivores, , 
9782923662091, Faut d la fuite dans les idées, Faut d la fuite dans les idées, Faut d la fuite dans les idées, , 
9782921818345, , Carnet de l univers, Carnet de l univers, , 
9782896510030, INDIE KIDD T04 QUAND EST, , Quand est ce qu on s amuse, , 
9782921310910, , Regards sur le poème, Regards sur le poème, , 
9782895792253, VAN L INVENTEUR T04, , Ça va barder, , 
9782922572412, , L Amérique un peu au bord du rouge absolu, L Amérique un peu, , 
9782764600089, , Le diable en personne, Le diable en personne, , 
9782895792994, DANSE DU DRAGON NO06, La danse du dragon, La danse du dragon, , 
9782890212009, , Un crocodile dans la baignoire, La drôle de vie de Méli Mélo, , 
9782890218147, TEMPS S ENFUIT, , Le temps s enfuit, , 
9782890518175, , Le meilleur ami du monde, Le meilleur ami du monde, , 
9782760172739, , Max Mallette le secret du mont Pinacle, Max Mallette, , 
9782895290520, , Les petits espaces, Les petits espaces, , 
9782921552108, , La bonne dame de Nohant, La bonne dame de Nohant, , 
9782764809013, Malefica tome 1, , Malefica, , 
9782924321065, , Défi aveugle, Défi aveugle, , 
9782895794059, BALEINES DES ILES DE LA, , Les baleines des Îles de la Madeleine, , 
9782896330584, , Odyssée troublante à la pointe claire, Odyssée troublante à la pointe claire, , 
9782894287089, , L intouchable aux yeux verts, L intouchable aux yeux verts, , 
9782896470969, , Le coeur rouge de la bohème, , Le Coeur rouge de la bohème, 
9782923708386, ATTRACTION, , Attraction, , 
9782923910116, Ping Pong NÂ 4 Textos terreur, , Textos terreur, , 
9782892613973, , Les racines de l ombre, Les racines de l ombre, , 
9782895128632, , Que cherche Galette dans la maison, Que cherche Galette dans la maison, , 
9782894314159, Au fil des jours, Au fil des jours, Au fil des jours, , 
9782890529657, , Les gens fidèles ne font pas les nouvelles, Les gens fidèles ne font pas les nouvelles, , 
9782924561034, , Hunter Jones Mystère au camp 13, Hunter Jones, , 
9782894314883, Les gardiens de l onirispère Tome 2, , Les gardiens de l onirisphère, , 
9782895794080, TREFLE D IRLANDE LE, , Le trèfle d Irlande, , 
9782890749658, , Adios, Adios, , 
9782890465683, , Musiques blanches, Musiques blanches, , 
9782890219823, EMO EPISODE 13 MAIS LE, , Emo, , 
9782897231606, , , Alias agent 008, Alias agent 008, 
9782897233839, , , C était en 1760 et la lune voyait rouge, C était en 1760 et la lune voyait rouge, 
9782894354117, Gaïg Tome 6, , Gaïg, , 
9782764406939, , Mon Nord magnétique, Mon Nord magnétique roman, , 
9782895372158, , Salut Max, Salut Max, , 
9782764605844, , Saucisson d âne et bave d escargot, Saucisson d âne et bave d escargot, , 
9782896150298, Les exilés NÂ 116, , Les exilés, , 
9782895122784, , Songes et mensonges, Songes et mensonges, , 
9782923621364, RADISSON T03 COUREURS, , Radisson, , 
9782893961843, , Mon clown et moi, Mon clown et moi, , 
9782897033613, Mon histoire en noir et blanc, Mon histoire en noir et blanc le clavier de ma vie, , , 
9782921310570, , Les sexes ivres, Les sexes ivres, , 
9782890527778, , Le vaisseau du désert, Le vaisseau du désert, , 
9782921548836, , Que fait Galette à la garderie, Que fait Galette à la garderie, , 
9782894351739, , Malourène et la dame étrange, Malourène et la dame étrange, , 
9782980809683, , L île des cigognes fanées, L île des cigognes fanées, , 
9782897234386, , , Jeu de puissance, Passion Hockey Tome 2, 
9782924187081, , Pyro fugue, Pyro fugue, , 
9782923563022, , Une semaine avec Galette, Une semaine avec Galette, , 
9782764601093, , Dans la foudre et la lumière, Dans la foudre et la lumière, , 
9782897140854, Pikiq, , Pikiq, , 
9782894353233, Les carcajous NÂ 31, Les carcajous, , , 
9782923574486, 000 terreur au camp d hiver, , Terreur au camp d hiver, , 
9782894507117, , Where is Teddy, Where is Teddy, , 
9780887763405, , Simon finds a feather, Simon finds a feather, , 
9782896080540, , Le pire moment, Le pire moment, , 
9782764404905, , Christophe Colomb, Christophe Colomb, , 
9782890316171, , Corps perdu, Corps perdu, , 
9782897810542, , , Eva Braun, Eva Braun Tome 2, 
9782895124310, , Théodore le mille pattes, Théodore le mille pattes, , 
9782894281129, , Le jeu des sept familles, Le jeu des sept familles, , 
9782980769023, , Les Trésors du Bac, Les trésors du bac, , 
9782896479696, , D or et de poussière, D or et de poussière, D or et de poussière, 
9782890518906, , Svetlana après Tchernobyl, Svetlana après Tchernobyl, , 
9782890212351, , Un crime audacieux, Un crime audacieux, , 
9782890064409, L ennemi intime, L ennemi intime les Québécois contre eux mêmes, , , 
9782894303068, , Ce service inestimable, Ce service inestimable, , 
9782897237530, , , In between, In Between, 
9782893812554, , Les bouquets de noces, Les bouquets de noces, , 
9782921310538, , La boîte avec le carré parfait, La boîte avec le carré parfait, , 
9782923530413, , Amour debout, Amour debout, , 
9782764403240, , Drôle de nuit pour Miti, Drôle de nuit pour Miti, , 
9782890212890, , Les cachotteries de ma soeur, Les cachotteries de ma soeur, , 
9782923574479, 000 terreur au camp d hiver lancement, , Terreur au camp d hiver, , 
9782894355077, Les adorateurs du scorpion NÂ 7, , Luna, , 
9782893962408, , Noces de papier, Noces de papier, , 
9782897511234, The Zelfs Bande dessinée 3, , The Zelfs aime ton Zelf, , 
9782895373285, , La reine Margot, La reine Margot, , 
9782897620943, Les douze travaux Nº 11, , Billy Stuart 11 Les douze travaux, , 
9782890215121, , Les cahiers d Élisabeth, Les cahiers d Élisabeth, , 
9782894302282, , Les parapluies du diable, Les parapluies du diable, , 
9782922565467, , Le chat qui voulait voler, Le chat qui voulait voler, , 
9781770762756, , Manigances, Histoires du Village, , 
9782896150717, Odyssées chimériques Nº 140, , Odyssées chimériques, , 
9782922572498, , Fenêtres du temps, Voilé dévoilé, , 
9782896071340, Trop long NÂ 104, Trooooooooooop long, Trooooooooooop long, , 
9782894356944, Agrippa Tome 1, , Agrippa, , 
9782890515206, , La couleur du rêve, La couleur du rêve, , 
9782924186008, , , Le testament de Maïakovski, , Le testament de Maïakovski
9782890516776, , L ombre du sorcier, L ombre du sorcier, , 
9782894190840, , Les pèlerins, Les pèlerins, , 
9782895290903, , Tout peut recommencer, Tout peut recommencer, , 
9782896609550, Coffret Princesse Sofia, , Princesse Sofia, , 
9782895404231, , Zachary et son Zloukch, Zachary et son Zloukch, , 
9782890056643, , Zone portuaire, Zone portuaire, , 
9782895910350, , La patinoire de rêve, La patinoire de rêve, , 
9782897238261, , , Botté d envoi, Botté d envoi, 
9782923844640, , Sand Bar, Sand Bar, , 
9782890062597, Ils ne demandaient qu à brûler, Ils ne demandaient qu à brûler poèmes 1960 1986, , , 
9782890211282, , Ma Babouche pour toujours, En souvenir de Babouche, , 
9782895795575, TU ME FAIS SOURIRE, , Tu me fais sourire, , 
9782896470976, , , Le sentier des Roquemont, Le Sentier des Roquemont Tome 3, 
9782894209165, , SOS au Lac des Glaces, SOS au Lac des Glaces, , 
978289612182X, , Entre l ombre et la lumière, Entre l ombre et la lumière, , 
9782890526011, , Petite géométrie du coeur, Petite géométrie du coeur, , 
9782923813004, Toujours près de toi, , Toujours près de toi, , 
9782890525791, , Morgane, Morgane, , 
9782894061668, , Le Survenant, Le Survenant, , 
9782896070028, , Que faire si des extraterrestres atterrissent sur votre tête, Que faire si des extraterrestres atterrissent sur votre tête, , 
9782894302940, , Marie Mousseau 1937 1957, Marie Mousseau 1937 1957, , 
9782890217493, , La grande frousse de Rosalie, La grande frousse de Rosalie, , 
9782894062583, , Agénor Agénor Agénor et Agénor, Agénor Agénor Agénor et Agénor, , 
9782764803233, Le Crime des roses, , Le crime des roses, , 
9782895121672, , Le petit musicien, Le petit musicien, , 
9782890057852, Au joli mois de mai, Au joli mois de mai, Au joli mois de mai, , 
9782764413210, , Robin Sylvestre 3 Voyage au cœur de la ville, Robin Sylvestre, , 
9782897411152, , Les ombres passantes suivi de Le projet informulé, Les ombres passantes suivi de Le projet informulé, , 
9782896957798, MISSION T01 MISSION OISIL, , Mission Mission oisillon, , 
9782896151288, L oiseau de feu 2A Le recyclage d Adakhan Nº 168, , L oiseau de feu v 2A Le recyclage d Adakhan, , 
9782896605293, Les Super Sens à la rescousse, , Les Super Sens à la rescousse, , 
