9782897110253, , , La fée des balcons, , La fée des balcons
9782895831686, , La grande tribu, La grande tribu, , 
9782890218422, , L audition de Thomas, L audition de Thomas, , 
9782894288351, , , , La Poussière du temps Tome 2, La poussière du temps tome 2
9782896471423, , , La poussière du temps, La Poussière du temps Tome 1 compact, 
9782896476053, , , Drôle de vampire, Drôle de vampire, 
9782764801688, , Eva, Eva, , 
9782896490011, Totale, , Totale, , 
9782895795940, CHEZ LES LICORNES, , Chez les licornes, , 
9782895021562, , L imaginaire de l eau, L imaginaire de l eau, , 
9782890055183, , Les faux départs, Les faux départs, , 
9782923682587, , Le cœur de Berlin, Le cœur de Berlin, , 
9782890218007, , Mon père et moi, Mon père et moi, , 
9782760932206, , Les filles de Sophie Barat, Les filles de Sophie Barat, , 
9782895493273, , Celtina la magie des Oghams, Celtina la magie des Oghams, , 
9782894061099, , Antoine et sa montagne, Antoine et sa montagne, , 
9782924519394, , , L imparfaite amitié, , L imparfaite amitié
9782890241572, , Quenamican, Quenamican, , 
9782897141851, Biscuit et Cassonade aiment l hiver, , Biscuit et Cassonade aiment l hiver, , 
9782922762157, , La magie des alphines, La magie des alphines, , 
9782892951658, , La belle épouvante, La belle épouvante, , 
978292256598X, , La puce co s mique et le rayon bleuge, La puce co s mique et Le rayon bleuge, , 
9782760139611, , Sur la tête de l eau, Sur la tête de l eau, , 
9782896340378, , Quelque chose de lui, Quelque chose de lui, , 
9782890067025, , Les mélancolies, Les mélancolies, , 
9782895403579, , L île chapeau, L île chapeau, , 
9782896476770, , , La Force de vivre tome 3, La Force de vivre Tome 3, 
9782892615494, , Dissonances, Dissonances, , 
9782762120829, , 100 comptines, 100 comptines compilées par Henriette Major illustrées par Christiane Beauregard et al ensemble multi supports, , 
9782896511181, , On finit toujours par payer, On finit toujours par payer, , 
9782895684398, Anne Avant la maison aux pignons verts, , Anne avant la maison aux pignons verts, , 
9782894205643, , Le stratège de Léda, Le stratège de Léda, , 
9782896601820, Le poème de Winnie Pooh s Poem, , Le poème de Winnie Pooh s poem, , 
978289111776X, , Héritiers de l éternité, Héritiers de l éternité, , 
9782897183646, Caillou La leçon de vélo, , Caillou, , 
9782896494330, Jours de tourmente, , Jours de tourmente, , 
9782921197936, , Circonstances particulières, Circonstances particulières, , 
9782897220020, Ru, , Ru, , 
9782896481071, Jardin brisé, Jardin brisé, , , 
9782921255103, , La couleur des mots, La couleur des mots, , 
9782896074129, Chroniques de l Après Terre Nº 115, Chroniques de l Après Terre, , , 
9782924025925, Raconte moi Pierre Elliott Trudeau Nº 6, Pierre Elliott Trudeau, , , 
9782895160104, , États de manque, États de manque, , 
9782924408575, , Passagers clandestins poésie urbaine, Passagers clandestins, , 
9782890185168, , Labyrinthe 5, Labyrinthe 5, , 
9782764621103, , C était au temps des mammouths laineux, C était au temps des mammouths laineux, , 
9782894302002, , L imposture, L imposture, , 
9782895910879, , Mes parents sont gentils mais tellement peureux, Mes parents sont gentils mais tellement peureux, , 
9782890059726, Secrets et pardons, , Secrets et pardons, , 
9782896073108, Zazette la chatte des Ouendats Nº 129, , Zazette la chatte des Ouendats, , 
9782897111298, , Les avatars du Poona Party, Les avatars du Poona Party, , 
9782764407400, , La pierre invisible, La pierre invisible, , 
9782890185397, , Zone franche, Zone franche, , 
9782923813042, Les chasseurs de trésors, Les chasseurs de trésors, Les chasseurs de trésors, , 
9782895436164, Garfield Nº 29, , Garfield, , 
9782896860210, , Les schmoucks, Les schmoucks, , 
9782895990360, , Le clan Rodriguez, Le clan Rodriguez, , 
9782922225828, , Du dino pour dîner, Du dino pour dîner, , 
9782764401582, , Sans coeur et sans reproche, Sans coeur et sans reproche, , 
9782897260453, L assassinat d Agnès NÂ 8, , L assassinat d Agnès, , 
9782895793045, SUPER TOUTOU NO03 ET LES, Super Toutou et les animaux abandonnés, Super Toutou et les animaux abandonnés, , 
9782897110130, , De pierres et de sang, De pierres et de sang, , 
9782895796817, FRUITS ETRANGES DE L AL, , L antihorloge, , 
9782895371067, , Vernissage, Vernissage, , 
9782890525775, , Rue Deschambault, Rue Deschambault, , 
9782896331185, , Quelle vie de chat Des vacances forcées, Quelle vie de chat, , 
9782896070117, , Les Tempêtes, Les Tempêtes ou Les mémoires d un Beatle raté, , 
9782897233907, , , Au bord de la rivière, Au bord de la rivière Tome 4 compact, 
9782895796329, TI GUY LA LUNE, , Ti Guy la lune, , 
9782895128267, , Alex et le mystérieux numéro sept, Alex et le mystérieux numéro sept, , 
9782896954742, PTS DEGOUTANTS ARAIGNEE, , L araignée, , 
9782890528235, , Poèmes pour la main gauche, Poèmes pour la main gauche, , 
9782923574400, Les fantômes de Péka NÂ 3, , Les fantômes de Péka, , 
9782764803851, Les Ailes du destin, Les ailes du destin, Les ailes du destin, , 
9782894061498, , À la brunante, À la brunante, , 
9782892951615, Smiley, , Smiley, , 
9782892612519, , Un été en Provence, Un été en Provence, , 
9782761331258, , Coucou petit espion, Coucou petit espion, , 
9782895850694, , Anosios tome 1, Anosios, , 
9782923896113, CIMETIERE DE POCHE, , Cimetière de poche, , 
9782896481002, 911, , 911, , 
9782895121656, , David et le fantôme, David et le fantôme, , 
978289021852X, , Du cyan plein les mains, Du cyan plein les mains, , 
9782980815403, , L homicide sensoriel, L homicide sensoriel, , 
9782896866717, , Les couleurs, Les couleurs, , 
9782890465071, , Le visage humain d un fleuve sans estuaire, Le visage humain d un fleuve sans estuaire suivi de Naguère, , 
9782895021961, , Les Baldwin, Les Baldwin, , 
9782890213366, , Marilou Polaire et l iguane des neiges, Marilou Polaire et l iguane des neiges, , 
9782896514847, MELI MELO T02, , Méli Mélo, , 
9782897540821, Léo P détective privé Tome 3, , Léo P détective privé, , 
9782896866250, , Une surprise pour Madame Poule, Une surprise pour Madame Poule, , 
978289435035X, , La machine à bulles, La machine à bulles, , 
9782896864133, , Vieux Thomas et la petite fée, Vieux Thomas et la petite fée, , 
9782923378060, Les confidences de Choupette, , Les confidences de Choupette, , 
9782895910170, , Mon pire prof, Mon pire prof, , 
9782897234621, , , Meurtre à Westmount, Meurtre à Westmount, 
9782764022184, La croisée des saisons, , La croisée des saisons, , 
9782896861514, , L or des gitans, L or des gitans, , 
9782760965023, , Les villes de naissance, Les villes de naissance, , 
9782890064832, , L impression du souci, L impression du souci ou L étendue de la parole, , 
9782897700560, 11 ANS FULGURANTS DE PIER, , Les onze ans fulgurants de Pierre Henri Dumouchel, , 
9782895991038, , Arôme de café, Pedro Libertad, , 
9782764601603, , Il n y a plus d Amérique, Il n y a plus d Amérique, , 
9782894502958, , Caillou, Caillou, , 
9782895371588, , Les pépins de Fabio, Les pépins de Fabio, , 
9782890183823, , Romans fleuves, Romans fleuves, , 
9782896956791, FEMME QUI DECIDA DE PASSE, , La femme qui décida de passer une année au lit, , 
9782895121591, , Zéro mon Zorro, Zéro mon Zorro, , 
9782896605620, Iron Man NÂ 2, , Iron Man, , 
9782895796275, REVANCHE DU LUTTEUR MAS, , La revanche du lutteur masqué, , 
9782764402260, , L homme de ma vie, L homme de ma vie, , 
9782892951399, , Amandes et melon, Amandes et melon, , 
9782981188571, , Les mystérieuses aventures d une romancière, Les mystérieuses aventures d une romancière, , 
9782922265323, , Le dimanche je suis amoureux de la mer, Le dimanche je suis amoureux de la mer, , 
9782922528367, , Il faut prendre le taureau par les contes, Trilogie de contes de village livres disques, , Il faut prendre le taureau par les contes
9782894313527, Le Cachot de Hautefaille, , Le cachot de Hautefaille, , 
9782923864082, , , Enraciné, , Enraciné
978289420311X, , Deux jumeaux et un chien, Deux jumeaux et un chien, , 
9782890214885, , Mes animaux, Mes animaux, , 
978292339805X, , Pages tombées d un livre, Pages tombées d un livre, , 
9782923501185, Les enfants de Poséidon Tome 1, , Les enfants de Poséidon, , 
9782895792437, MANGE TA SOUPE MARLOU, , Mange ta soupe Marlou, , 
9782896514380, NOTDOG T04, , Notdog, , 
9782921775484, , Les crimes du hasard, Les crimes du hasard, , 
9782896479474, , , Psycho boys volume 1, Psycho Boys Tome 1, 
9782892613809, , Negão et Doralice, Negão et Doralice, , 
9782890528286, , Premières armes, Premières armes 1918, , 
9782764602227, , Paul en Finlande, Paul en Finlande, , 
9782897660956, , Quelle mémoire plisse leur visage suivi de Souffles, Quelle mémoire plisse leur visage suivi de Souffles, , 
9782894850778, , Le miroir aux tartuffes, Le miroir aux tartuffes, , 
9782764402333, , Les animaux du petit géant, Les animaux du petit géant, , 
9782922225593, , Un chien dans un jeu de quilles, Un chien dans un jeu de quilles, , 
9782742706372, , , La grosse femme d à côté est enceinte, , La grosse femme d à côté est enceinte
9782895490163, , La temps meurtrier, La temps meurtrier, , 
9782764605325, , Un certain sens du ridicule, , , Un Certain Sens du Ridicule
9782760947146, , Va et nous venge, Va et nous venge, , 
9782897512989, Coffret Ma première bibliothèque La Pat Patrouille, , La Pat Patrouille, , 
9782894851065, , Almazar dans la cité, Almazar dans la cité, , 
9782896481033, Stainless, , Stainless, , 
9780887762972, , Simón celebra la primavera, Simón celebra la primavera, , 
9782894302851, , Maïna, Maïna, , 
9782890217302, , La vie comptée de Raoul Lecompte, La vie comptée de Raoul Lecompte, , 
9782921620413, , Le chat botté à New York, Le chat botté à New York, , 
9782896480142, Ã l extrême du temps, À l extrême du temps, À l extrême du temps, , 
9782924666241, , , Amqui, , Amqui
9781300749165, , Éden et le monde vert tome 3, Éden et le monde vert, , 
9782890526089, , Chaminet Chaminouille, Chaminet Chaminouille, , 
9782764401191, , Les souliers magiques, Noémie, , 
9782980485306, , Le marcheur, Le marcheur, , 
9782894191340, , Psyché au cinéma, Psyché au cinéma, , 
9782890517055, , Les ailes de lumière, Les ailes de lumière, , 
9782895122423, , Momo sur Mars, Momo sur Mars, , 
9782895370494, , Lettre à Alexia, Mille millions de misères, , 
9782923530437, , Comme si tu avais encore le temps de rêver Com si encara tinguessis temps de somiar, Comme si tu avais encore le temps de rêver Com si encara tinguessis temps de somiar, , 
9782764603215, , Le siècle de Jeanne, Le siècle de Jeanne, , 
9782894237960, , , Andréanne Mars, , Andréanne Mars
9782922572919, , M atterres, M atterres, , 
9782894350155, , Oliver s great loves, Oliver s great loves, , 
9782895123403, , Le bébé de Binou, Le bébé de Binou, , 
9782894191316, , Carnets d une habituée, Carnets d une habituée, , 
9782895434115, Boite a lecture 12 dora exp 2, , La boîte à lecture 2, , 
9782921055546, , Le lutin des mers, Le lutin des mers, , 
9782921197200, , La déconvenue, La déconvenue, , 
9782890066347, , Avec des yeux d enfant, Avec des yeux d enfant, , 
9782897234409, , , Dans l ombre d Edison tome 2, Dans l ombre d Edison Tome 2, 
9782894541163, , L amour en exil, L amour en exil, , 
9782895910688, , La sorcière La Manetta, La sorcière La Manetta, , 
9782895128373, , Autocollants trop merveilleux, Autocollants trop merveilleux, , 
9782921818605, , La poésie se mange crue, La poésie se mange crue, , 
9782895125679, , Rougeline et le loup, Rougeline et le loup, , Rougeline et le loup
9782897140458, L arbre de Paolo, , L arbre de Paolo, , 
9782894289563, , , Lygaya, Lygaya, 
9782923713694, , Détour par First Avenue, Détour par First Avenue, , 
9782896603770, Garfield NÂ 58, , Garfield, , 
9782896516636, , , Psy malgré moi, , De la dépression qu on soigne à la SPCA Psy malgré moi dossier 05
9782897124113, , Adel l apprenti migrateur, Adel l apprenti migrateur, , 
9782890318083, , Sylvestre au temps des galimatias, Sylvestre au temps des galimatias, , 
9782894485002, , Comprends tu ça Laurette, Comprends tu ça Laurette, , 
9782895797098, PIANISTE DE LA FIN DU M, , L antihorloge 3 Le pianiste de la fin du monde, , 
9782924438022, , Perfecto Tome 2, Perfecto tome 2, , 
9782895796084, AU SECOURS YURI, , Au secours Yuri, , 
9782895405245, , Tu me prends en photo, Tu me prends en photo, , 
9782895658474, , , Les pierres des dieux, , Soif de pouvoir
9782890066975, , Personne du plus grand nombre, Personne du plus grand nombre, , 
9782897239510, , , Rozmaring, Rozmaring, 
9782764406106, , Isis ma belle Isis, Isis ma belle Isis, , 
9782896071104, Justine et Sofia au pays des bleuets NÂ 97, Justine et Sofia au pays des bleuets, Justine et Sofia au pays des bleuets, , 
9782890185206, , La mort était extravagante, La mort était extravagante suivi de Nous sommes beaucoup qui avons peur, , 
9782890517888, , Les chats du parc Yengo, Les chats du parc Yengo, , 
9782890055922, , Chronique de la dérive douce, Chronique de la dérive douce, , 
9782890527921, , Le soleil des gouffres, Le soleil des gouffres, , 
9782894352212, Sapristi chéri Nº 25, Sapristi chéri, Sapristi chéri, , 
9782890066800, , Journal du dedans, Journal du dedans, , 
9782890217418, , Polo et la fête de la citrouille, Polo et la fête de la citrouille, , 
9782897142094, Un jour je bercerai la terre, , Un jour je bercerai la terre, , 
9782896942480, , , Dans l oeil du soleil, , Dans l oeil du soleil
9782894289242, , , Complot au musée, Complot au musée, 
9782896609048, Les avions, , Tous pour un, , 
9782896473687, , , Les Mésaventures de Grosspafine volume 2, Les Mésaventures de Grosspafine Tome 2, 
9782760947597, , , La chaleur des mammifères, , La chaleur des mammifères
9782897236311, , , 1967 t 2 Une ingénue à l expo, 1967 Tome 2, 
9782895797272, SANS PAUSE PUBLICITAIRE, , Sans pause publicitaire, , 
9782897220327, La Saline tome 3, , La Saline v 3 Impératifs, , 
9782760931889, , Le chemin Saint Jacques, Le chemin Saint Jacques, , 
9782896952229, UN ELEPHANT, , Un éléphant, , 
9782895902553, , Spisak Un cadeau ne se refuse pas, Spisak v 1 Un cadeau ne se refuse pas, , 
9782894061188, , Mémoire sans jours, Mémoire sans jours, , 
9782890311724, , Le comédon, Le comédon ou Les aventures de William Roschildren, , 
9782764804193, Cœur trouvé aux objets perdus, Coeur trouvé aux objets perdus, Coeur trouvé aux objets perdus, , 
9782892951585, Regards et jeux dans l espace, Regards et jeux dans l espace et autres poèmes, Regards et jeux dans l espace et autres poèmes, , 
9782890264211, , Zara, Zara ou La mer noire, , 
9782894060904, , Jean Rivard le défricheur, Jean Rivard le défricheur suivi de Jean Rivard économiste, , 
9782894286961, , Grand Nord, Grand Nord, , 
9782890182924, , Ainsi chavirent les banquises, Ainsi chavirent les banquises, , 
9782894312385, , Le retour de l exilé, Le retour de l exilé, , 
9782895912453, , Les pouvoirs de Super Hakim, Les pouvoirs de Super Hakim, , 
9782924261620, , , Les Corbin de Dumontel 1968 1977, , Les Corbin de Dumontel 1968 1977
9782895021287, , Les inventés, Les inventés, , 
9782890525244, , L obéissance, L obéissance, , 
9782896490806, Le masque du gerfaut, Le masque du gerfaut, Le masque du gerfaut, , 
9782924259634, La naissance d une nation, , La naissance d une nation, , 
9782923841403, , , Red Ketchup, , Red Ketchup tome 6
9782895122881, , Trop amoureux, Trop amoureux, , 
9782890216241, , Les effets sont secondaires, Les effets sont secondaires, , 
9782923342856, La petite pieuvre qui voulait jouer du piano, , La petite pieuvre qui voulait jouer du piano, , 
9782764606896, , C est un jeu, C est un jeu, , 
9782896475230, , Les métropoles culturelles dans l espace francophone, , Les métropoles culturelles dans l espace francophone, Les Metropoles Culturelles Dans l Espace Francophone
9782895792444, ILE DU DIEU CANARD L, , L île du dieu Canard, , 
9782894312016, , Par le chemin des marais, Par le chemin des marais, , 
9782890468879, , Poèmes du lendemain 13, Poèmes du lendemain 13, , 
9782894307071, , Par un si beau matin, Par un si beau matin, , 
9782890464849, , Fille au bord de l eau, Fille au bord de l eau, , 
9782896070718, Pio Tchi aux grands pieds Nº 83, , Pio Tchi aux grands pieds, , 
9782897231361, , , Effe, Effe, 
978289261306X, , Le coureur de froid, Le coureur de froid, , 
9782980063541, , L Araignée du silence, , , L araignée du silence
9782894354384, Will GhÃ¼ndee Tome 5, Will Ghündee La chute du souverain, Will Ghündee, , 
9782922145956, , Le dernier rayon du soleil, Le dernier rayon du soleil, , 
9782897140618, La machine à explorer le temps, , La machine à explorer le temps, , 
9782895126027, , Les mousses, Les mousses, , 
9782895129264, , Un baiser pour Julos, Un baiser pour Julos, , 
9782895796886, FLEURS POUSSENT AUSSI S, , Les fleurs poussent aussi sur les trottoirs, , 
9782980211583, , L effet mère, L effet mère, , 
9782764401248, , Tohu Bohu le grand boum, Tohu Bohu, , 
9782894488843, , Janvier tous les jours, Janvier tous les jours, , 
9782896478019, , , Coventry, Coventry, 
9782764404379, , Asphalte et vodka, Asphalte et vodka, , 
9782892952261, Whisky et Paraboles, Whisky et paraboles, Whisky et paraboles, , 
9782891119320, Evangile de marie madeleine, , L Évangile de Marie Madeleine, , 
9782894356616, Surprise NÂ 3, , Les soucis d un Sansoucy, , 
9782762540798, , Mes parents sont fous, Mes parents sont fous, , 
9782896511914, KABOUM T18 LE REPAIRE, , Kaboum, , 
9782890218058, , Un terrible secret, Un terrible secret, , 
9782896476367, , , Souvenirs d amour, Souvenirs d amour, 
9782762141238, , , William et Eva tome 1, , William et Eva tome 1
9782894316047, Au cœur de la vallée Tome 2, Au coeur de la vallée t 2 Partir ou rester, , , 
9782896513758, KABOUM T25 LE POULET, , Kaboum, , 
9782892952107, , Une collection de lumières, Une collection de lumières, , 
9782897239114, , , Sur le rythme, Sur le rythme Tome 1, 
9782764606735, , La petite poule d eau, La petite poule d eau, , 
9782923150697, , La pointe à Ti Jean, La pointe à Ti Jean, , 
9782890241211, , Train d enfer, Train d enfer, , 
9782894314609, L enfant des neiges Tome 5, , Les portes du passé, , 
9782895128625, , Que cache Galette dans sa salopette, Que cache Galette dans sa salopette, , 
9782764605714, , La brèche, La brèche, , 
9782890182991, , Champ libre, Champ libre, , 
9782890058026, , Les murs des planètes, Les murs des planètes suivi de La cathédrale aveugle, , 
9782923521039, , Simon et la porte de fer, Simon et la porte de fer, , 
9782896956753, PT PAT T01 TOUT LE MO, Petit Pat vol 1, Petit Pat, , 
9782890212157, , Fais un voeu Nazaire, Fais un voeu Nazaire, , 
9782895290245, , Les rats d Élodie, Les rats d Élodie, , 
9782890241181, , Objets de mémoire, Objets de mémoire, , 
9782764621127, , La nuitte de Malcomm Hudd, La nuitte de Malcolmm Hudd, , La Nuitte de Malcomm Hudd
9782896865956, , Opération bifteck, Opération bifteck, , 
9782923425006, , Le renne de Robin, Le renne de Robin, , 
9782764600186, , Au loup, Au loup, , 
9782894850018, , Pâques à Miami, Pâques à Miami, , 
9782896602179, Garfield NÂ 53, , Garfield, , 
9782895129813, , Galette raffole des fruits, Galette raffole des fruits, , 
9782762585759, , Mastok et Moustik, Mastok et Moustik, , 
9782896330140, , Matin noir dans les passages secrets, Matin noir dans les passages secrets, , 
9782923521107, , Noirceur et autres couleurs, Noirceur et autres couleurs, , 
9782895911562, , Hollywood nous voici, Hollywood nous voici, , 
9782890213773, , Un message d Étamine Léger, Un message d Étamine Léger, , 
9782896475704, , , Treize, TREIZE Tome 1, Treize tome 1
9782894192672, , Entre les mondes, Entre les mondes, , 
9782896472529, , , Aubergine, Aubergine Ce n est pas drôle la garderie, 
978289052566X, , En panne dans la tempête, En panne dans la tempête, , 
9782890218619, , Accidents de parcours, Accidents de parcours, , 
9782896860272, , Mon premier amour, Mon premier amour, , 
9782896150403, Les leçons de la cruauté NÂ 127, , Les leçons de la cruauté, , 
9782896452132, , Sur le fil de l ombre, Sur le fil de l ombre, , 
9782890515877, , La marque rouge, La marque rouge, , 
9782764804704, Noblesse déchirée tome 3, , Noblesse déchirée, , 
9782895128359, , Trop curieuse, Trop curieuse, , 
9782890182487, , L un et l autre, L un et l autre, , 
9782894303327, , L ermite, L ermite, , 
9782890517993, , La dernière nuit de l Empress of Ireland, La dernière nuit de l Empress of Ireland, , 
9782895712404, , Des nouvelles de la Terre perdue, Des nouvelles du pays de la Terre perdue, , 
9782895435044, Cendrillon s en va au bal, , Cendrillon s en va au bal, , 
9782891117425, Chardon et le tartan t1, , Le chardon et le tartan, , 
9782896480852, Un poète et son double, , Un poète et son double Jean Narrache Émile Coderre, , 
9782890378993, , Marie Tempête, Marie Tempête, , 
9782890214761, , Un blouson dans la peau, Un blouson dans la peau, , 
9782764811726, Embrasse ton amour sans lâcher ton couteau, , Embrasse ton amour sans lâcher ton couteau, , 
9782896602919, Humour de zombies NÂ 1, , Humour de zombies, , 
9782896514137, CATHERINE ET STEPHANIE, Catherine et Stéphanie, Catherine et Stéphanie, , 
9782895122202, , Du bout des doigts le bout du monde, Du bout des doigts le bout du monde, , 
9782764425718, , Vacances monstres, Vacances monstres, , 
9782922792196, , Le trésor de Frank, Le trésor de Frank, , 
9782762584701, , L odyssée du Pénélope, L odyssée du Pénélope, , 
9782895291725, , J amour, J amour, , 
9782924561003, , Will Ghündee L Invasion, Will Ghündee volume 7 L Invasion, , 
9782890182657, , Noir déjà, Noir déjà, , 
9782764416846, , Au nom de Compostelle, Au nom de Compostelle, , 
9782890467953, , Le livre de la lumière, Le livre de la lumière, , 
9782890055507, , Soho, Soho, , 
9782921310422, , Les ailes inachevées du désordre, Les ailes inachevées du désordre, , 
9782764800010, Catalina, , Catalina, , 
9782896513116, PSY MALGRE MOI EPISODE 7, Du relooking extrême pour l estime de soi, Psy malgré moi, , 
9782890213641, , Lettre à Madeleine, Lettre à Madeleine, , 
9782764400500, , L énigme de Sales Laterrière, L énigme de Sales Laterrière, , 
9782897032371, Camille, Camille, Camille, , 
978289021219X, , Le chat de mes rêves, Le chat de mes rêves, , 
978289021480X, , Les rats du Yellow Star, Les rats du Yellow Star, , 
9782922050289, , Chroniques de ma résurrection, Chroniques de ma résurrection, , 
9782895793991, LIVRE DE GRAND PAPA, , Le livre de grand papa, , 
9782764600453, , Sept lacs plus au Nord, Sept lacs plus au Nord, , 
9782762540801, , Tout à l envers, Tout à l envers, , 
9782895370192, , Mon père ce salaud, Mon père ce salaud, , 
9782895954866, , Le Tyran de l ouest, Le tyran de l ouest, , 
9782894353170, , Sapristi et les bandits, Sapristi et les bandits, , 
9782896478613, , , Mélusine et Philémon, Mélusine et Philémon Tome 2, 
9782896080731, , Zargouille fait le beau, Zargouille fait le beau, , 
9782895021422, , La désertion, La désertion, , 
9782924259344, Sept Tome 7, , Le dernier message, , 
9782896609987, Rachel et la mer, , Rachel et la mer, , 
9782894287879, , Je regarde les femmes, Je regarde les femmes, , 
9782894353028, L enfer vert, , L enfer vert, , 
9782894060459, , Le chemin des dames, Le chemin des dames, , 
9782894312180, , L initiation, L initiation, , 
9782922572145, , Sur les ailes d un ange, Sur les ailes d un ange et autres moyens de transport inadéquats, , 
9782890217957, , L arrivée des Inactifs, L arrivée des Inactifs, , 
9782764024775, Bouchées de plaisir, , Bouchées de plaisir, , 
9782895794721, BATAILLE DU DRAGON 08, , La bataille du dragon, , 
9782762570344, , Tadam, Tadam, , 
9782895371830, , Dans les pas de Caïn, Dans les pas de Caïn, , 
9782764406656, , Filou et Zami se déguisent, Filou et Zami se déguisent, , 
9782895494485, , Nikki Pop, Nikki Pop, , 
9782895857129, , Le bonheur des autres tome 2, Le bonheur des autres tome 2 Le revenant, , 
9782892257793, Les lettres secrètes du moine qui vendit sa Ferrari, , Les lettres secrètes du moine qui vendit sa Ferrari, , 
9782764603142, , Immobile, Immobile, , 
9782890218895, , Aurélie et l île de Zachary, L archipel des rêves, , 
9782890217876, , Chambre froide, Chambre froide, , 
9782923603230, , , Le protocole Reston, , Le protocole Reston
9782921856560, , Noire de soleil, Noire de soleil, , 
9782896515028, PROTEGE MOI DE MES DESIRS, , Protège moi de mes désirs, , 
9782895124280, , Les bêtises des parents, Les bêtises des parents, , 
9782921775301, , Charpente sauvage, Charpente sauvage, , 
9782924043080, , Vite Il faut sauver le blanchon, Vite Il faut sauver le blanchon, , 
9782895795407, VIC VOTRE SECOURS NO02, , Vic votre secours, , 
9782897235321, , , Dracula, Dracula, 
9782896479689, , , Quand je serai grand, Quand je serai grand, 
9782890525554, , Adrienne, Adrienne, , 
9782922892956, , Voir venir la patience, Voir venir la patience, , 
9782890213781, , Les fantômes d Élia, Les fantômes d Élia, , 
9782923910673, Frayeur venue du ciel N 24, , Frayeur venue du ciel, , 
9782923910932, Fabuleux Nº 3, , Fabuleux Le trésor c est par là, , 
9782890518531, , Le secret de Simon, Le secret de Simon, , 
9782897238483, , , La dérive du cornichon, La dérive du cornichon, 
9782896473038, , , Gnomes dépôt, Gnomes Dépôt Tome 2, 
9782894289761, , , Délit de fuite, Délit de fuite, 
9782924498170, , L Énigme du Caire, L énigme du Caire, , 
9782897142025, Défense d entrer 6, , Défense d entrer, , 
9782896476183, , Rose de La Tuque, Rose de La Tuque, Rose de La Tuque, 
9782890519511, , L envahisseur, L envahisseur, , 
